{"ancestor_v1_dataset_registry_hash":"0933ad65870a245a5fa441ddb657d40ed8f76e854c12286b17e753148fcdaf50","counts":{"test":15,"train":50,"validation":10},"epoch":1,"inherited_count":75,"manifest_hash":"b23cd5716ab46033f7ea0bf123cc9b2a5f401fa37dbffddba8d4201f5ea76145","new_count":0,"parent_epoch":null,"parent_manifest_hash":null,"parent_registry_snapshot_hash":null,"per_chromosome":{"chr18":{"test":3,"train":10,"validation":2},"chr19":{"test":3,"train":10,"validation":2},"chr20":{"test":3,"train":10,"validation":2},"chr21":{"test":3,"train":10,"validation":2},"chr22":{"test":3,"train":10,"validation":2}},"ratio_basis":{"test":3,"train":10,"validation":2},"ratio_basis_total":15,"registry_snapshot_hash":"3e60aa65aeed8969e29ebeef83024f6fa2285a13c155d7d6dc0c601d1e94f675","salt":"minos-l2-split-v2","samples":[{"assignment_source":"v1-inherited","chromosome":"chr18","dataset_id":"minos-chr18-028662fb934529d7","identity_tuple_hash":"0713db5917cf4b8fca5fb3e663d4b07320ecf144aa20f4e46d65339ee01edb76","origin_epoch":1,"partition":"train","round_id":"028662fb934529d7"},{"assignment_source":"v1-inherited","chromosome":"chr18","dataset_id":"minos-chr18-031b9ed22a572248","identity_tuple_hash":"11a7b939a57e92baca674ddcc75c6c28454fac694f8c79d19dfa50c4d89f9201","origin_epoch":1,"partition":"train","round_id":"031b9ed22a572248"},{"assignment_source":"v1-inherited","chromosome":"chr18","dataset_id":"minos-chr18-0f7636039ced5e18","identity_tuple_hash":"1c69cd6e7a6efe9da2bc818111635fc1fd7e7a1a18fbfb4bc005b83d541fef65","origin_epoch":1,"partition":"test","round_id":"0f7636039ced5e18"},{"assignment_source":"v1-inherited","chromosome":"chr18","dataset_id":"minos-chr18-266e9e3efe9bb8f3","identity_tuple_hash":"a1a53204fc8602b2821f55773c2397acc7095e2c9d2344a23e010e8fd5f81ce1","origin_epoch":1,"partition":"validation","round_id":"266e9e3efe9bb8f3"},{"assignment_source":"v1-inherited","chromosome":"chr18","dataset_id":"minos-chr18-3567ff83fbc9de9a","identity_tuple_hash":"ee3ff782947ca42b56576e0cfc082291adf63c32e0f4790d70853ef96ac20eba","origin_epoch":1,"partition":"train","round_id":"3567ff83fbc9de9a"},{"assignment_source":"v1-inherited","chromosome":"chr18","dataset_id":"minos-chr18-4041408c84aa1dd9","identity_tuple_hash":"1442c781aca30fb579fa57753ca3a53b069f4ac0490ad4087e8a56e5ea9c30ae","origin_epoch":1,"partition":"train","round_id":"4041408c84aa1dd9"},{"assignment_source":"v1-inherited","chromosome":"chr18","dataset_id":"minos-chr18-49a0587df4584484","identity_tuple_hash":"24fae6395145875cf893476e5594f2fb15106f15528b1639fb6a843995526be0","origin_epoch":1,"partition":"test","round_id":"49a0587df4584484"},{"assignment_source":"v1-inherited","chromosome":"chr18","dataset_id":"minos-chr18-5e50748cb9a892f0","identity_tuple_hash":"c59620e15fc7c1746a4352b949c6d87548bea2ab7cc4cd935b7aac89eeeaa08b","origin_epoch":1,"partition":"train","round_id":"5e50748cb9a892f0"},{"assignment_source":"v1-inherited","chromosome":"chr18","dataset_id":"minos-chr18-7643aa4c08de0902","identity_tuple_hash":"d96af351d00e74296b61ea1cad44a89849b1af2170d0fa7cf66368fadcda5427","origin_epoch":1,"partition":"validation","round_id":"7643aa4c08de0902"},{"assignment_source":"v1-inherited","chromosome":"chr18","dataset_id":"minos-chr18-8b9c7a20f60eea9a","identity_tuple_hash":"762171ae243b6cd661bcec249066c69dd2f0799dc56cc90828480d7397035458","origin_epoch":1,"partition":"train","round_id":"8b9c7a20f60eea9a"},{"assignment_source":"v1-inherited","chromosome":"chr18","dataset_id":"minos-chr18-928d791fe2038793","identity_tuple_hash":"c05a9dd14e291718df5785ff1fb05d47672091adb9e187c7b8730da0040ddfdc","origin_epoch":1,"partition":"train","round_id":"928d791fe2038793"},{"assignment_source":"v1-inherited","chromosome":"chr18","dataset_id":"minos-chr18-93c9991cf89f333f","identity_tuple_hash":"3c7d23ae0522af69a67fd649249d3299c47ad0332c884c754d21e54203c32ad6","origin_epoch":1,"partition":"test","round_id":"93c9991cf89f333f"},{"assignment_source":"v1-inherited","chromosome":"chr18","dataset_id":"minos-chr18-e4927d298da3764c","identity_tuple_hash":"bc4f44d7fa94d9e9ec3cabec0d8a8ac9ea71ecb9eabaa8c6ab9d699a72fdcdc4","origin_epoch":1,"partition":"train","round_id":"e4927d298da3764c"},{"assignment_source":"v1-inherited","chromosome":"chr18","dataset_id":"minos-chr18-e6c996b13500d289","identity_tuple_hash":"5f30a4e1277e0abec8f4c734b5e714145be9c64a9b585c45334f2735b72e5482","origin_epoch":1,"partition":"train","round_id":"e6c996b13500d289"},{"assignment_source":"v1-inherited","chromosome":"chr18","dataset_id":"minos-chr18-edba96cdd5db71ad","identity_tuple_hash":"535906c711326e6cbf3d3a7a372f9bd461a4770216ba68179c675f2e0f22261a","origin_epoch":1,"partition":"train","round_id":"edba96cdd5db71ad"},{"assignment_source":"v1-inherited","chromosome":"chr19","dataset_id":"minos-chr19-0de906231aa96ade","identity_tuple_hash":"37d4562832ea3d4546ded6af33dd95b16fbd180ccd5244a89023b757d328ebd3","origin_epoch":1,"partition":"train","round_id":"0de906231aa96ade"},{"assignment_source":"v1-inherited","chromosome":"chr19","dataset_id":"minos-chr19-11fff0d59c751113","identity_tuple_hash":"a6840d1f9755f181aa3c868a49f8c33d36ae26aabefc6f31924ac8ae72d44170","origin_epoch":1,"partition":"test","round_id":"11fff0d59c751113"},{"assignment_source":"v1-inherited","chromosome":"chr19","dataset_id":"minos-chr19-19cb53f42f8d403f","identity_tuple_hash":"e49dc7129079280047e40fb9131061532428a198f5d53ce42a3a6c2106a5ddfc","origin_epoch":1,"partition":"train","round_id":"19cb53f42f8d403f"},{"assignment_source":"v1-inherited","chromosome":"chr19","dataset_id":"minos-chr19-236a5b6eb032f900","identity_tuple_hash":"ebb9920186c13fcf866aca1eca7cdb89e87df45ba76b4e706f277f68c2c9a2db","origin_epoch":1,"partition":"validation","round_id":"236a5b6eb032f900"},{"assignment_source":"v1-inherited","chromosome":"chr19","dataset_id":"minos-chr19-3f0b7080f5275894","identity_tuple_hash":"9590ff5ef88146d24fd319592397ae3b5e7112c2230d9c6f9350c407d5b06455","origin_epoch":1,"partition":"train","round_id":"3f0b7080f5275894"},{"assignment_source":"v1-inherited","chromosome":"chr19","dataset_id":"minos-chr19-437f1a6d9711f228","identity_tuple_hash":"f516e1c853728c8d860694bf98b27e4d2a4e09ea1776dc3911bfcdcb089993fc","origin_epoch":1,"partition":"train","round_id":"437f1a6d9711f228"},{"assignment_source":"v1-inherited","chromosome":"chr19","dataset_id":"minos-chr19-6ec3321a48e2d601","identity_tuple_hash":"15736c4414d8c32a4513858a65c39a4d2b3ac886f68a5b2ca9061651ba89174b","origin_epoch":1,"partition":"train","round_id":"6ec3321a48e2d601"},{"assignment_source":"v1-inherited","chromosome":"chr19","dataset_id":"minos-chr19-7b256bda9f1dfe47","identity_tuple_hash":"2ba639ddc81e4a632407906cbc8c1292e6fa8dea857f4023140f47ea7109b814","origin_epoch":1,"partition":"test","round_id":"7b256bda9f1dfe47"},{"assignment_source":"v1-inherited","chromosome":"chr19","dataset_id":"minos-chr19-bd2c02d78c591220","identity_tuple_hash":"e0297a6cff2b4ea4cb5ab60659fbff3ce711f2a4fc52eeacc90e7a53f9dd5557","origin_epoch":1,"partition":"test","round_id":"bd2c02d78c591220"},{"assignment_source":"v1-inherited","chromosome":"chr19","dataset_id":"minos-chr19-c90975c261e78ddb","identity_tuple_hash":"7471b848a761e2817568525616edb4d360e98540778b4086e701b587d7a8b0b7","origin_epoch":1,"partition":"train","round_id":"c90975c261e78ddb"},{"assignment_source":"v1-inherited","chromosome":"chr19","dataset_id":"minos-chr19-e0069f65aabcd78c","identity_tuple_hash":"f37b1cc10747662f9c252665cfc382e7d8e008a3749afcdcc94943920c1689ab","origin_epoch":1,"partition":"train","round_id":"e0069f65aabcd78c"},{"assignment_source":"v1-inherited","chromosome":"chr19","dataset_id":"minos-chr19-efe397623605138d","identity_tuple_hash":"ac61bc1a2ff66e0f91fea464d47a91b53176e3818fe0dbea80cec50ba7d3e92c","origin_epoch":1,"partition":"train","round_id":"efe397623605138d"},{"assignment_source":"v1-inherited","chromosome":"chr19","dataset_id":"minos-chr19-f34543ba78e3de48","identity_tuple_hash":"07bb9e28a111948162504cd188b4afd0d724d751eba8a25008407e6f8a52149a","origin_epoch":1,"partition":"train","round_id":"f34543ba78e3de48"},{"assignment_source":"v1-inherited","chromosome":"chr19","dataset_id":"minos-chr19-ff150fd013413702","identity_tuple_hash":"c5991c6cf5dd0a771429d25c5eaf205e07b779a2a802845c13e494af9ad63e3b","origin_epoch":1,"partition":"validation","round_id":"ff150fd013413702"},{"assignment_source":"v1-inherited","chromosome":"chr19","dataset_id":"minos-chr19-ff9fa88cc9b19e5b","identity_tuple_hash":"063adcb6a1fb0ae785e8308d96c6918333f2da79d9191432ce26fc9baa41092e","origin_epoch":1,"partition":"train","round_id":"ff9fa88cc9b19e5b"},{"assignment_source":"v1-inherited","chromosome":"chr20","dataset_id":"minos-chr20-2aeeddc1d86288f3","identity_tuple_hash":"f4b3bc5e712d0976ca7377c32c8e6eb595b3535c3ce14af48074ac3706d95a44","origin_epoch":1,"partition":"validation","round_id":"2aeeddc1d86288f3"},{"assignment_source":"v1-inherited","chromosome":"chr20","dataset_id":"minos-chr20-42bdea88e6242d37","identity_tuple_hash":"a97a5985648200bbcc6c6680f40d060fa228404f56a23155274d4cb47491711e","origin_epoch":1,"partition":"train","round_id":"42bdea88e6242d37"},{"assignment_source":"v1-inherited","chromosome":"chr20","dataset_id":"minos-chr20-431e276db18d8470","identity_tuple_hash":"65895e6aaa59a59d8a901d8c96d9bef2c322d7cbf2642aef2e6a90c337f1b5e6","origin_epoch":1,"partition":"train","round_id":"431e276db18d8470"},{"assignment_source":"v1-inherited","chromosome":"chr20","dataset_id":"minos-chr20-447ff7bc49369aa3","identity_tuple_hash":"3654cf6d18e90a2b9e78a6e5e99602787164376be2f8d63368b71e3b0deffed4","origin_epoch":1,"partition":"train","round_id":"447ff7bc49369aa3"},{"assignment_source":"v1-inherited","chromosome":"chr20","dataset_id":"minos-chr20-58b71bbb0ba04b1a","identity_tuple_hash":"74c6d300a428b3c09c8b503406b595bcdaeff19cd690e45d39eeafddd45cb0ae","origin_epoch":1,"partition":"test","round_id":"58b71bbb0ba04b1a"},{"assignment_source":"v1-inherited","chromosome":"chr20","dataset_id":"minos-chr20-790db6d6b1fd44e9","identity_tuple_hash":"61ef011367a24f9